{
  "renderVersion": "1",
  "binding": {
    "semanticRevision": "9b4bbd3989eec282adc384e163c85f1131696b7fc77a2b352b1f35b75bd31363",
    "profileDigest": "28f60d420d9688c19264a616f3a6bee41abcea01c9413293dbb5ee5f2be45884",
    "descriptorDigest": "8cb3013f19489ae7b9eee46d790186ef3c8c4b5df17a63f397de1e066ad74719",
    "layoutDigest": "a15c5025af83891f1a3dcda82c08dde3161dbf1d95576ca1910c7da0100414ae",
    "themeId": "plain",
    "themeDigest": "e2ec603d6be51b30824aebe5474ff4d89948f5400ac16708d42f82e921a6be10",
    "overridesDigest": "e5d14358eed3eebbde859d54222bab9b9054c681496ba84ac751e77adc932b8c",
    "diStylesDigest": "b9807dcc0243e9a28c1ca1e15b1b7858f334dd92bb76270ba1a8a097062599e4",
    "metricsDigest": "4f02aa1a16d22d03bebaac92939210302637ba59a8a47504690986b40483d051",
    "payloadDigest": "546be6db38d0aa235fe500aff4a5064834ae57b85071d762d46b034ceb162729"
  },
  "pages": [
    {
      "pageId": "Page_Empty",
      "name": "Empty sheet",
      "order": 0,
      "semanticRootId": "Process_Empty",
      "bounds": {
        "x": 0,
        "y": 0,
        "width": 700000,
        "height": 300000
      }
    }
  ],
  "occurrences": [
    {
      "pageId": "Page_Empty",
      "occurrenceKey": "Pool_Empty_di",
      "semanticId": "Pool_Empty",
      "role": "support",
      "bounds": {
        "x": 0,
        "y": 0,
        "width": 600000,
        "height": 200000
      },
      "label": {
        "text": "Empty process",
        "bounds": {
          "x": 0,
          "y": 0,
          "width": 30000,
          "height": 200000
        },
        "lines": [
          "Empty process"
        ]
      },
      "emittedType": "node",
      "style": [
        {
          "name": "arrow",
          "value": "none"
        },
        {
          "name": "fill",
          "value": "#ffffff"
        },
        {
          "name": "fontFamily",
          "value": "fixture-sans"
        },
        {
          "name": "fontSize",
          "value": 10
        },
        {
          "name": "fontWeight",
          "value": "normal"
        },
        {
          "name": "stroke",
          "value": "#000000"
        },
        {
          "name": "strokeWidth",
          "value": 1
        },
        {
          "name": "textColor",
          "value": "#000000"
        }
      ],
      "glyphId": "pool"
    }
  ],
  "coverage": [
    {
      "semanticId": "Definitions_Empty",
      "occurrences": [],
      "disposition": "nonvisual"
    },
    {
      "semanticId": "Process_Empty",
      "occurrences": [],
      "disposition": "nonvisual"
    },
    {
      "semanticId": "Collab_Empty",
      "occurrences": [],
      "disposition": "nonvisual"
    },
    {
      "semanticId": "Pool_Empty",
      "occurrences": [
        {
          "pageId": "Page_Empty",
          "occurrenceKey": "Pool_Empty_di"
        }
      ],
      "disposition": "rendered"
    }
  ],
  "diagnostics": []
}
